{
  "generated_at": "2026-10-20T05:42:28.710Z",
  "projects_active": 7,
  "projects_closed": 0,
  "projects_unclassified": 8,
  "followup_urgent": 3,
  "followup_pending": 5,
  "followup_snooze": 1,
  "commercial_flags_high": 5,
  "commercial_flags_medium": 6,
  "revenue_total_eur": 10200,
  "invoices_total": 1,
  "ledger_template_only_count": 11
}
